{
  "$schema": "uefn.handoff.v1",
  "handoff_id": "H-BUILD-016",
  "from": "Physics_Programmer",
  "to": ["Gameplay_Programmer", "AI_Programmer", "UI_Programmer", "Graphics_Programmer"],
  "artifact": "04_devices.json",
  "mission_ref": "M-CORPOPLAZA-BUILD-05",
  "summary_short": "Esplanade 21x21 posee : 441 sols + 128 entites, 1 device spawner, audit live 0 erreur, 582 acteurs legaux.",
  "payload": {
    "devices": [
      {
        "actor_label": "Spawner_Plaza_01",
        "asset_key": "player_spawner",
        "device_class": "player_spawner_device",
        "asset_path": "/CRD_PlayerSpawn/ItemDefinitions/PID_CP_Devices_PlayerSpawner.PID_CP_Devices_PlayerSpawner",
        "placement_mode": "TILE_ANCHOR",
        "tile": [4, 11, 0],
        "slot": "CENTER",
        "face_towards": "NORTH",
        "on_floor": true,
        "mirror": true,
        "status": "placed",
        "ref_path": "/dc587e05-5351-4d88-b9bd-dc21fbb17a81/claudtest.claudtest:PersistentLevel.BP_Creative_Player_Spawner_Prop_C_UAID_08F97E52BCAA090E03_1884200392",
        "xform": {
          "location": { "x": 3389.81, "y": 6897.64, "z": 128.0 },
          "rotation": { "pitch": 0.0, "yaw": 0.0, "roll": 0.0 },
          "scale": { "x": 1.0, "y": 1.0, "z": 1.0 }
        },
        "properties": {},
        "bindings": []
      }
    ],
    "placement": {
      "requested": 128,
      "placed": 128,
      "missing": [],
      "fallback_count": 0
    },
    "audit": {
      "source": "live",
      "status": "PASSED",
      "error_count": 0,
      "overlap_errors": [],
      "gravity_errors": [],
      "scene_errors": [],
      "gravity_scope": "bounds relus dans l'editeur",
      "other_report": "passages etroits : 06_navigation_report.json (check-navigation)",
      "timestamp": "2026-10-23T22:52:11.163775+00:00"
    },
    "reports": {
      "06_navigation_report": {
        "status": "PASSED",
        "error_count": 0,
        "navigation_errors": [],
        "navigation_scope": "paires d'acteurs (props et devices) dans une meme tuile ; pas de capsule, pas de murs, pas de passages entre tuiles"
      },
      "06_legality_report": {
        "status": "PASSED",
        "valid_actors": 582,
        "illegal_count": 0,
        "illegal_actors": []
      },
      "11_symmetry_report": {
        "status": "PASSED",
        "source": "live",
        "axis": null,
        "symmetric": false,
        "checked_pairs": 0,
        "scope": "AUCUN AXE : 03_grid.json ne declare pas symmetry_axis. La symetrie des devices et des props n'est PAS verifiee."
      }
    }
  },
  "constraints": {
    "z_floor": -16,
    "z_ceiling": 384,
    "must_preserve": ["Spawner_Plaza_01", "Bassin_Memorial_01", "Plateforme_21x21"],
    "forbidden": [
      "aucun acteur hors spec dans le niveau",
      "aucun chemin hors 02_palette.json ; aucun chemin refuse par le validateur UEFN",
      "aucun deplacement manuel dans l'Outliner"
    ]
  },
  "golden_example_ref": "skill/exemples/geometrie-21x21-auditee.json",
  "acceptance": [
    "all_specs_placed",
    "transforms_reliefs",
    "audit_source_live",
    "0_overlap",
    "0_floating",
    "0_scene_errors",
    "0_illegal_actors",
    "no_temporary_actor",
    "refpath_persisted"
  ],
  "next_step_hint": "Verse : cabler Spawner_Plaza_01 sur son refPath (jamais sur le label seul si un second label apparait). La scene est contemplative : aucun @editable, aucun Game_Manager cree, 10_editables.json = NO_VERSE_STAGED assume.",
  "context_budget_tokens": 4000,
  "exemple_annotations": {
    "role": "GOLDEN EXAMPLE - la forme attendue du livrable",
    "pourquoi_il_passe": [
      "audit.source = live et les trois listes vides en plus du compteur",
      "chaque device porte un ref_path + la transform RELUE (exploitable par les agents 12/13/14)",
      "le 11_symmetry_report n'est pas sur-vendu : axis null = aucun controle de symetrie, dit tel quel",
      "summary_short <= 200 caracteres, que des faits atomiques, aucune prose de raisonnement"
    ]
  }
}
